{
  "$schema": "https://probavi.dev/schemas/capabilities/capabilities.json",
  "_generated": "GENERATED FILE — do not edit by hand. Produced by `go generate ./...` from the code that implements each capability; edits are overwritten and CI fails on any diff. Contract: docs/capabilities.md",
  "schema": "probavi-capabilities/1",
  "project": {
    "status": "pre-alpha",
    "license": "Apache-2.0",
    "repository": "https://github.com/probavi/probavi"
  },
  "contracts": {
    "adapter_protocol": {
      "version": "probavi-adapter/0",
      "spec": "docs/adapter-protocol.md",
      "schema": "docs/schemas/adapter/"
    },
    "evidence_schema": {
      "version": "probavi-evidence/1",
      "readable_versions": [
        "probavi-evidence/0",
        "probavi-evidence/1"
      ],
      "spec": "docs/evidence-schema.md",
      "schema": "docs/schemas/evidence/record.json",
      "independent_verifier": "spec/evidence"
    },
    "notification_payload": {
      "version": "probavi-notification/1",
      "spec": "docs/notifications.md",
      "schema": "docs/schemas/notification/payload.json"
    }
  },
  "adapters": [
    {
      "id": "mongodb",
      "name": "MongoDB",
      "status": "experimental",
      "adapter_version": "0.1.0",
      "engine": {
        "id": "mongodb",
        "name": "MongoDB"
      },
      "protocol_versions": [
        "probavi-adapter/0"
      ],
      "verified": [
        {
          "engine_version": "7",
          "image": "mongo:7"
        }
      ],
      "sources": [
        {
          "id": "mongodump",
          "name": "One mongodump archive, plain or gzip",
          "pitr": false
        },
        {
          "id": "mongodump_dir",
          "name": "A directory of mongodump archives; the newest is restored",
          "pitr": false
        }
      ],
      "pitr": false,
      "conformance_verified": true,
      "docs": "adapters/mongodb/README.md"
    },
    {
      "id": "mssql",
      "name": "SQL Server",
      "status": "experimental",
      "adapter_version": "0.1.0",
      "engine": {
        "id": "sqlserver",
        "name": "Microsoft SQL Server"
      },
      "protocol_versions": [
        "probavi-adapter/0"
      ],
      "verified": [
        {
          "engine_version": "2022",
          "image": "mcr.microsoft.com/mssql/server:2022-latest"
        }
      ],
      "sources": [
        {
          "id": "bak",
          "name": "One native SQL Server .bak backup file",
          "pitr": false
        },
        {
          "id": "bak_dir",
          "name": "A directory of .bak files; the newest is restored",
          "pitr": false
        }
      ],
      "pitr": false,
      "conformance_verified": true,
      "docs": "adapters/mssql/README.md"
    },
    {
      "id": "mysql",
      "name": "MySQL",
      "status": "experimental",
      "adapter_version": "0.2.0",
      "engine": {
        "id": "mysql",
        "name": "MySQL"
      },
      "protocol_versions": [
        "probavi-adapter/0"
      ],
      "verified": [
        {
          "engine_version": "8.4",
          "image": "mysql:8.4"
        }
      ],
      "sources": [
        {
          "id": "mysqldump",
          "name": "One mysqldump SQL file",
          "pitr": false
        },
        {
          "id": "mysqldump_dir",
          "name": "A directory of mysqldump files; the newest is restored",
          "pitr": false
        },
        {
          "id": "xtrabackup",
          "name": "An unprepared Percona XtraBackup full backup (physical restore)",
          "pitr": false
        }
      ],
      "pitr": false,
      "conformance_verified": true,
      "docs": "adapters/mysql/README.md"
    },
    {
      "id": "postgres",
      "name": "PostgreSQL",
      "status": "experimental",
      "adapter_version": "0.3.0",
      "engine": {
        "id": "postgresql",
        "name": "PostgreSQL"
      },
      "protocol_versions": [
        "probavi-adapter/0"
      ],
      "verified": [
        {
          "engine_version": "16",
          "image": "postgres:16"
        }
      ],
      "sources": [
        {
          "id": "pgbackrest",
          "name": "A pgBackRest filesystem repository (physical restore)",
          "pitr": true
        },
        {
          "id": "pgdump",
          "name": "One pg_dump custom-format (-Fc) file",
          "pitr": false
        },
        {
          "id": "pgdump_dir",
          "name": "A directory of pg_dump files; the newest is restored",
          "pitr": false
        }
      ],
      "pitr": true,
      "conformance_verified": true,
      "docs": "adapters/postgres/README.md"
    }
  ],
  "sandbox_providers": [
    {
      "id": "docker",
      "name": "Docker",
      "status": "experimental",
      "params": [
        {
          "id": "image",
          "required": true,
          "default": null,
          "doc": "Sandbox image; it must contain the engine and the restore tooling the adapter drives."
        },
        {
          "id": "network",
          "required": false,
          "default": "none",
          "doc": "Docker network the sandbox joins."
        },
        {
          "id": "memory",
          "required": false,
          "default": null,
          "doc": "Container memory limit (docker run --memory)."
        },
        {
          "id": "cpus",
          "required": false,
          "default": null,
          "doc": "Container CPU limit (docker run --cpus)."
        },
        {
          "id": "command",
          "required": false,
          "default": null,
          "doc": "Container command override, split on whitespace and executed without a shell — for engines the adapter starts itself."
        },
        {
          "id": "env.<NAME>",
          "required": false,
          "default": null,
          "doc": "Environment variable set inside the sandbox."
        }
      ],
      "isolation": {
        "network_default": "none",
        "published_ports": false,
        "storage": "container filesystem and anonymous volumes, removed with the container",
        "forced_teardown": true,
        "orphan_sweep": "host- and pid-scoped labels, swept at drill start",
        "external_backstop": null
      },
      "constraints": [
        "Requires a reachable Docker daemon; the docker CLI is driven directly, never the SDK.",
        "Remote daemons work unchanged through the CLI's native SSH transport (DOCKER_HOST=ssh://user@host). The endpoint stays in the environment: sandbox params are recorded verbatim in signed evidence, and connection details must never appear there.",
        "Publishing ports is not expressible: the provider never emits -p."
      ],
      "verified_against": [
        "local Docker daemon (CI integration suite)",
        "remote daemon over the docker CLI SSH transport (CI integration suite)"
      ],
      "docs": null
    },
    {
      "id": "k8s",
      "name": "Kubernetes Job",
      "status": "experimental",
      "params": [
        {
          "id": "image",
          "required": true,
          "default": null,
          "doc": "Sandbox image; it must contain the engine and the restore tooling the adapter drives."
        },
        {
          "id": "namespace",
          "required": false,
          "default": "default",
          "doc": "Namespace the Job is created in."
        },
        {
          "id": "memory",
          "required": false,
          "default": null,
          "doc": "Container memory request and limit, set equal so the pod is guaranteed."
        },
        {
          "id": "cpus",
          "required": false,
          "default": null,
          "doc": "Container CPU request and limit, set equal so the pod is guaranteed."
        },
        {
          "id": "command",
          "required": false,
          "default": null,
          "doc": "Container command override, split on whitespace — for engines the adapter starts itself."
        },
        {
          "id": "env.<NAME>",
          "required": false,
          "default": null,
          "doc": "Environment variable set inside the sandbox."
        }
      ],
      "isolation": {
        "network_default": null,
        "published_ports": false,
        "storage": "pod filesystem, deleted with the Job",
        "forced_teardown": true,
        "orphan_sweep": "host- and pid-scoped labels, swept at drill start",
        "external_backstop": "cluster-side: activeDeadlineSeconds 7200 then TTL 600s, so a sandbox dies even if the drill host does"
      },
      "constraints": [
        "Requires a working kubectl context with rights to create, exec into, and delete Jobs in the target namespace; the kubectl CLI is driven directly, never client-go.",
        "Network isolation is the cluster's job: the pod carries the sandbox label so a NetworkPolicy can select it. There is no pod-level equivalent of the docker provider's --network none.",
        "The pod runs with no service-account token, no service links, and the RuntimeDefault seccomp profile.",
        "Per-command environment values reach the command through stdin, never the command line: kubectl exec has no environment flag, and a value in argv would be readable from the process list on the drill host and inside the pod. Requires sh in the image, as put_file already does."
      ],
      "verified_against": [
        "kind cluster (CI integration suite)"
      ],
      "docs": null
    },
    {
      "id": "remotehost",
      "name": "Bare host over SSH",
      "status": "experimental",
      "params": [
        {
          "id": "workspace_root",
          "required": false,
          "default": "/var/lib/probavi-drills",
          "doc": "Absolute path on the target holding per-drill workspaces."
        },
        {
          "id": "memory",
          "required": false,
          "default": null,
          "doc": "MemoryMax of the drill's transient systemd slice (systemd size suffixes)."
        },
        {